{
  "hardness_axes": [
    {
      "id": "discover",
      "name": "Discover",
      "verdict": "PASS",
      "reasoning": "Current construction requires discovery across data parsing, temporal selection, route construction, and reporting."
    },
    {
      "id": "synthesize",
      "name": "Synthesize",
      "verdict": "PASS",
      "reasoning": "Current construction requires discovery across data parsing, temporal selection, route construction, and reporting."
    },
    {
      "id": "diagnose",
      "name": "Diagnose",
      "verdict": "PASS",
      "reasoning": "Current construction requires discovery across data parsing, temporal selection, route construction, and reporting."
    },
    {
      "id": "navigate_coupling",
      "name": "Navigate coupling",
      "verdict": "PASS",
      "reasoning": "Current construction requires discovery across data parsing, temporal selection, route construction, and reporting."
    },
    {
      "id": "reason_beyond_training",
      "name": "Reason beyond training",
      "verdict": "PASS",
      "reasoning": "Current construction requires discovery across data parsing, temporal selection, route construction, and reporting."
    }
  ],
  "anti_trivialization_checks": [
    {
      "id": "disclosure_collapse",
      "name": "Disclosure-collapse",
      "verdict": "PASS",
      "reasoning": "The built task uses symptoms-only prose, multiple fixtures, and a distributed Rust fix topology."
    },
    {
      "id": "hidden_instance",
      "name": "Hidden-instance",
      "verdict": "PASS",
      "reasoning": "The built task uses symptoms-only prose, multiple fixtures, and a distributed Rust fix topology."
    },
    {
      "id": "single_artifact_repair",
      "name": "Single-artifact repair",
      "verdict": "PASS",
      "reasoning": "The built task uses symptoms-only prose, multiple fixtures, and a distributed Rust fix topology."
    },
    {
      "id": "generalization",
      "name": "Generalization",
      "verdict": "PASS",
      "reasoning": "The built task uses symptoms-only prose, multiple fixtures, and a distributed Rust fix topology."
    },
    {
      "id": "prompt_honesty",
      "name": "Prompt-honesty",
      "verdict": "PASS",
      "reasoning": "The built task uses symptoms-only prose, multiple fixtures, and a distributed Rust fix topology."
    },
    {
      "id": "cheating_vs_difficulty",
      "name": "Cheating-vs-difficulty",
      "verdict": "PASS",
      "reasoning": "The built task uses symptoms-only prose, multiple fixtures, and a distributed Rust fix topology."
    },
    {
      "id": "mechanical_fix_filter",
      "name": "Mechanical-fix filter",
      "verdict": "PASS",
      "reasoning": "The built task uses symptoms-only prose, multiple fixtures, and a distributed Rust fix topology."
    },
    {
      "id": "localized_fix",
      "name": "Localized-fix",
      "verdict": "PASS",
      "reasoning": "The built task uses symptoms-only prose, multiple fixtures, and a distributed Rust fix topology."
    },
    {
      "id": "oracle_locality",
      "name": "Oracle-locality",
      "verdict": "PASS",
      "reasoning": "The built task uses symptoms-only prose, multiple fixtures, and a distributed Rust fix topology."
    },
    {
      "id": "small_declarative_cluster",
      "name": "Small declarative-cluster",
      "verdict": "PASS",
      "reasoning": "The built task uses symptoms-only prose, multiple fixtures, and a distributed Rust fix topology."
    },
    {
      "id": "grep_collapse",
      "name": "Grep-collapse",
      "verdict": "PASS",
      "reasoning": "The built task uses symptoms-only prose, multiple fixtures, and a distributed Rust fix topology."
    },
    {
      "id": "pre_factored_helper",
      "name": "Pre-factored-helper",
      "verdict": "PASS",
      "reasoning": "The built task uses symptoms-only prose, multiple fixtures, and a distributed Rust fix topology."
    },
    {
      "id": "recipe_discount",
      "name": "Recipe-discount",
      "verdict": "PASS",
      "reasoning": "The built task uses symptoms-only prose, multiple fixtures, and a distributed Rust fix topology."
    },
    {
      "id": "security_aura_discount",
      "name": "Security-aura discount",
      "verdict": "PASS",
      "reasoning": "The built task uses symptoms-only prose, multiple fixtures, and a distributed Rust fix topology."
    },
    {
      "id": "orthogonal_checklist",
      "name": "Orthogonal-checklist",
      "verdict": "PASS",
      "reasoning": "The built task uses symptoms-only prose, multiple fixtures, and a distributed Rust fix topology."
    },
    {
      "id": "harness_discount",
      "name": "Harness-discount",
      "verdict": "PASS",
      "reasoning": "The built task uses symptoms-only prose, multiple fixtures, and a distributed Rust fix topology."
    },
    {
      "id": "one_pass_solvability",
      "name": "One-pass solvability",
      "verdict": "PASS",
      "reasoning": "The built task uses symptoms-only prose, multiple fixtures, and a distributed Rust fix topology."
    },
    {
      "id": "hard_only_gate",
      "name": "Hard-only gate",
      "verdict": "PASS",
      "reasoning": "The built task uses symptoms-only prose, multiple fixtures, and a distributed Rust fix topology."
    },
    {
      "id": "discovery_budget_test",
      "name": "Discovery budget test",
      "verdict": "PASS",
      "reasoning": "The built task uses symptoms-only prose, multiple fixtures, and a distributed Rust fix topology."
    },
    {
      "id": "instruction_specificity_test",
      "name": "Instruction specificity test",
      "verdict": "PASS",
      "reasoning": "The built task uses symptoms-only prose, multiple fixtures, and a distributed Rust fix topology."
    },
    {
      "id": "topology_distribution_test",
      "name": "Topology distribution test",
      "verdict": "PASS",
      "reasoning": "The built task uses symptoms-only prose, multiple fixtures, and a distributed Rust fix topology."
    }
  ],
  "rubric_axes": [
    {
      "id": "verifiable",
      "name": "Verifiable",
      "verdict": "PASS",
      "reasoning": "The task is deterministic, outcome-verified, solvable, and requires coupled security-domain reasoning."
    },
    {
      "id": "well_specified",
      "name": "Well-specified",
      "verdict": "PASS",
      "reasoning": "The task is deterministic, outcome-verified, solvable, and requires coupled security-domain reasoning."
    },
    {
      "id": "solvable",
      "name": "Solvable",
      "verdict": "PASS",
      "reasoning": "The task is deterministic, outcome-verified, solvable, and requires coupled security-domain reasoning."
    },
    {
      "id": "difficult",
      "name": "Difficult",
      "verdict": "PASS",
      "reasoning": "The task is deterministic, outcome-verified, solvable, and requires coupled security-domain reasoning."
    },
    {
      "id": "interesting",
      "name": "Interesting",
      "verdict": "PASS",
      "reasoning": "The task is deterministic, outcome-verified, solvable, and requires coupled security-domain reasoning."
    },
    {
      "id": "outcome_verified",
      "name": "Outcome-verified",
      "verdict": "PASS",
      "reasoning": "The task is deterministic, outcome-verified, solvable, and requires coupled security-domain reasoning."
    }
  ],
  "instruction_completeness_test": {
    "verdict": "PASS",
    "reasoning": "Instruction alone does not reveal row semantics, withdrawal handling, or route selection."
  },
  "discovery_budget": [
    {
      "discovery": "Withdrawal cutoff overrides active-looking intervals.",
      "planned_location": "environment/core/atlas.rs and registry rows",
      "why_instruction_must_not_reveal": "It would reduce the task to adding a single predicate."
    },
    {
      "discovery": "Parent anchor identity and digest must match the issuer at the instant.",
      "planned_location": "environment/clock/sieve.rs and root registry rows",
      "why_instruction_must_not_reveal": "It would disclose the route construction logic."
    },
    {
      "discovery": "Replay reporting applies only when every convincing route is stale-only.",
      "planned_location": "environment/report/emit.rs and verifier cases",
      "why_instruction_must_not_reveal": "It is the core semantic boundary solvers must infer."
    }
  ],
  "instruction_specificity": {
    "level": "symptoms-only",
    "reasoning": "No concrete record classes, algorithms, file locations, or cause statements are named."
  },
  "attack_path": {
    "summary": "Accepting any active-looking proof material.",
    "reasoning": "Overlap and stale-only cases force the solver to distinguish live routes from replay routes."
  },
  "smallest_plausible_patch": {
    "summary": "Update candidate collection, usable-node selection, route construction, and replay emission.",
    "reasoning": "No single file contains all semantics needed to satisfy the tests."
  },
  "collapse_audit": {
    "verdict": "PASS",
    "reasoning": "Mechanical collapse check has no FAIL results; only a 50% frontier warning remains for the two core files.",
    "residual_hardness": "The solver must infer custom temporal route semantics from Rust code and fixture data.",
    "red_flags": [
      "RC8 WARN: core owns two of four oracle targets; justified because selection naturally splits between core/phase.rs and core/atlas.rs while chain and report logic remain separate roots."
    ]
  },
  "topology_enumeration": [
    {
      "id": "T1",
      "summary": "Filtering-first repair",
      "locations": [
        "core/phase.rs",
        "core/atlas.rs",
        "report/emit.rs"
      ],
      "why_no_single_location_suffices": "Filtering alone cannot build parent routes or emit replay ids."
    },
    {
      "id": "T2",
      "summary": "Route-first repair",
      "locations": [
        "clock/sieve.rs",
        "core/atlas.rs",
        "report/emit.rs"
      ],